{
  "chunk_duration_s": 10.0,
  "error_message": null,
  "error_stage": null,
  "infer_ms": 7.871825,
  "input": "fixtures/audio/10s_mix.wav",
  "istft_ms": 4.198306,
  "metadata": {
    "channels": 1,
    "clock_fallback": false,
    "clock_source": "perf_counter",
    "device_requested": "cpu",
    "device_used": "cpu",
    "mode": "smoke",
    "sample_width_bytes": 2,
    "samples_processed": 441000,
    "stages": [
      "stft",
      "infer",
      "istft"
    ]
  },
  "sample_rate_hz": 44100,
  "status": "ok",
  "stft_ms": 3.673518,
  "timestamp": "2026-05-10T02:19:29.407254+00:00",
  "total_ms": 15.743649
}
